index,district,grab_and_go_meals,offering,dates,hours,link,meals,school_name,school_address,city,state,zip_code,latitude,longitude,county,country,accuracy_score,accuracy_type,main_office_phone,grades,level,notes
1,Alamogordo Public Schools,TRUE,"Grab & Go meals will be available for curbside pickup at all school sites. For students who normally ride the school bus, Grab & Go meal packs will be delivered to designated bus stops.",,12 p.m. to 1 p.m.,https://sites.google.com/alamogordoschools.org/covid19/feeding-our-kids?authuser=0,,,,Alamagordo,NM,88310,32.870046,-105.948967,Otero County,US,1,place,,,,
3,Animas Public Schools,,No information currently available.,,,,,,,Animas,NM,88020,32.053042,-108.906944,Hidalgo County,US,1,place,,,,No info posted yet.
4,Artesia Public Schools,TRUE,The Artesia Public Schools will be serving breakfast and lunch to all currently enrolled students in Artesia Public Schools. Students may pick up their breakfast and lunch at any school in the district.,March 16 through April 3,8 a.m. to 9:30 a.m.,https://www.bulldogs.org/news#coronavirusupdatemarch132020,,,,Artesia,NM,88210,32.771797,-104.219669,Eddy County,US,1,place,,,,
5,Aztec Municipal School,TRUE,"Meal service will be provided  at Aztec High School ONLY on Monday March 16th and 17th.  Beginning  on Wednesday, March 18th service expands to  Aztec High, Park, Rippey and McCoy schools. Grab & Go Breakfast and Lunch will be provided. Additional community sites will be announced as they are confirmed.",,"Breakfast: 7:30 a.m. to 8:30 a.m.
Lunch: 11 a.m. to 12:30 p.m.",https://www.aztecschools.com/,,,,Aztec,NM,87410,36.842198,-107.818288,San Juan County,US,1,place,,,,
6,Belen Consolidated Schools,TRUE,Families will receive lunch and the following morning's breakfast at pick up beginning March 16th. Pick-up site does not need to be the student’s home school; they can select the most convenient site. Students must be present to claim meals.,,10:30 a.m. to 12:30 p.m.,https://www.beleneagles.org/article/208848?org=bcs,,,,Belen,NM,87002,34.651051,-106.695247,Valencia County,US,1,place,,,,
7,Bernalillo Public Schools,TRUE,Grab & Go meals will be distributed at all school sites. Breakfast and lunch will be picked up together.,,9 a.m. to 10 a.m.,https://www.bernalillo-schools.org/Domain/8,,,,Bernalillo,NM,87004,35.300040,-106.551140,Sandoval County,US,1,place,,,,
8,Bloomfield Schools,TRUE,Meals will be distributed at Bloomfield High School. The district is sending out a Robo call and posting information on their website. They are advising students and families to watch for the the buses.,,10 a.m. to 1 p.m.,http://www.bsin.k12.nm.us/,,,,Bloomfield,NM,87413,36.711120,-107.984510,San Juan County,US,1,place,,,,
9,Capitan Municipal Schools,TRUE,"All students, at all grade levels, who attend Capitan Municipal Schools are welcomed and encouraged to receive meals from the cafeteria in Traylor Gym. The Food 4 Kids Backpack Program will continue to have food for all registered students. Pickups are available Monday - Thursday from March 16th - April 2nd. Breakfast and lunch meals will be available at the same time so that families need only come once per day to campus.",,7:30 a.m. to 9:30 a.m.,https://www.facebook.com/TigersCapitan/,,,,Capitan,NM,88316,33.501389,-105.612793,Lincoln County,US,1,place,,,,
10,Carlsbad Municipal Schools,TRUE,"
Breakfast and lunch meals will be provided daily beginning March 16th at the following locations: Hillcrest Elementary, Carlsbad High School, Carlsbad
Intermediate School, Desert Willow Elementary and Carlsbad Sixth Grade Academy. Please follow signs when you arrive.
",,9 a.m. -10:30 a.m.,https://www.carlsbadschools.net/,,,,Carlsbad,NM,88220,32.416897,-104.465390,Eddy County,US,1,place,,,,
11,Carrizozo Muncipal Schools,TRUE,"Meals will be served from 9:30 - 12:00 for students Monday - Thursday in the school cafeteria. They will not be served during the week of March 23rd - March 27th, which is our scheduled Spring Break.",,9:30 a.m. to 12 p.m.,https://cms-k12-mt.schoolloop.com/,,,,Carrizozo,NM,88301,33.641799,-105.875816,Lincoln County,US,1,place,,,,
12,Central Consolidated,TRUE,"Grab & Go hot lunches will be served to children ages 1 to 18, from Monday, March 16th -  Wednesday, April 1st at Kirtland Middle School, Shiprock High School, and Newcomb High School. Serving time is 11:00 a.m. to 12:30 p.m. Children must be personally present at the distribution site to receive meals. These sites will serve district families until Central Consolidated Schools reopen. There will be no eating the meals at the school.",,11 a.m. to 12:30 p.m.,http://www.ccsdnm.org/,,,,Shiprock,NM,87420,36.791890,-108.697850,San Juan County,US,1,place,,,,
13,Chama Valley Independent Schools,TRUE,"During the 3 week closure beginning March 16th, the district will provide breakfast/lunch for all enrolled students on Monday - Thursdays. School and community pickup locations and times are posted on the district website.",,,https://www.chamaschools.org/,,,,Tierra Amarilla,NM,87575,36.696968,-106.576636,Rio Arriba County,US,1,place,,,,
14,Cimarron Municipal Schools,TRUE,"Students can pick up a Grab & Go Lunch and Breakfast at the following locations, Monday - Friday, for the duration of the closure:
Cimarron Elementary Cafeteria (West side of building): 11:00 am - 12:00 pm daily 
Eagle Nest School (front of the building): 11:30 am - 12:30 pm daily
Angel Nest Apartments (front of the building): 11:45 am - 12:00 pm daily
Angel Skye Apartments (front of the building): 12:00 pm - 12:15 pm daily
Lowe's grocery store (front of the building): 12:30 pm - 1:30 pm daily",,Varies by location,http://www.cimarronschools.org/,,,,Cimarron,NM,87714,36.504216,-104.905419,Colfax County,US,1,place,,,,
15,Clayton Municipal Schools,TRUE,"The district will be providing Grab & Go meals for students of Clayton Municipal Schools beginning Monday, March 16th. Parents should register for breakfast, lunch or both meals under the ""Parent"" tab on our website each day their child/ren will be eating. Parents will be notified on Monday via a SchoolMessenger call when and where the meals will be available for pick up.",,Please register on the website for time confirmation,https://www.facebook.com/Clayton-Municipal-Schools-243780196020618/,,,,Clayton,NM,88415,36.451155,-103.162935,Union County,US,1,place,,,,
16,Cloudcroft Municipal Schools,TRUE,"Cloudcroft High School cafeteria will remain open to provide grab & go breakfast and lunch meals to school-age students. Meal distribution will be located at the high school cafeteria at the South entrance (HWY 82 side) from 9:30-12:00, Tuesday through Friday, during the weeks of March 17th - March 20th  and March 31st -April 3rd.",,9:30 a.m. to 12 p.m.,https://tb2cdn.schoolwebmasters.com/accnt_21720/site_21721/Documents/New-School-Closure-2020.pdf,,,,Cloudcroft,NM,88317,32.889717,-105.674395,Otero County,US,1,place,,,,beginning march 17
17,Clovis Muncipal Schools,TRUE,"The district will continue to provide breakfast and lunch available to students, free of charge, between March 16th - 20th and March 30th - April 3rd. Students do not have to go to the school they attend to participate, so they may access the school site most convenient to them. Students must be present to receive a meal. All school cafeterias, with the exception of the iAcademy at Lincoln-Jackson, will be open for food pick-up for anyone 18 and under from 8-11 a.m. iAcademy students will go to the school site most convenient to them. Meals will be distributed at the rear entrance to each cafeteria. Students will receive breakfast and lunch at the same time. Modified menus will be posted to the District's website. Meals will not be provided between March 23rd - 27th, which is the week of Spring Break.",,8 a.m. to 11 a.m.,http://www.clovis-schools.org/Press%20Releases/2020/PRESS%20RELEASE%20-%20COVID-19%20UPDATE%2003_13_2020.pdf,,,,Clovis,NM,88101,34.497241,-103.294978,Curry County,US,1,place,,,,
18,Cobre Consolidated School District,TRUE,Grab & Go breakfast and lunch will be provided at each school site after spring break. No one will be allowed to stay at the sites and eat. Any updates will be posted on Facebook and School Messenger messages.,,,https://www.facebook.com/cobre.k12.nm.us/,,,,Bayard,NM,88023,32.761740,-108.130600,Grant County,US,1,place,,,,
19,Corona Public Schools,TRUE,"Grab & Go breakfast and lunch meals will be provided for all enrolled students from March 16th - April 3rd. Times and locations below. If additonal community feeding resources become avalaible, parents will be notified by the district. 

9:00- Corona Cafeteria- Grab and go breakfast and lunch 

9:30- Cedarville Center Parking Lot- Grab and go breakfast
and lunch

9:30- Duran Parking lot- Grab and go breakfast and lunch

9:30- Mile Marker 18 Highway 247- Grab and go breakfast and
lunch

9:45- Claunch Post Office Parking Lot- Grab and go breakfast
and lunch

Meals provided will include milk and other USDA approved
commodity products. If food restrictions are required please notify personnel
prior to delivery.
",,Times vary by location.,https://www.facebook.com/cpscardinals/,,,,Corona,NM,88318,34.249031,-105.596655,Lincoln County,US,1,place,,,,
22,Des Moines Municipal Schools,TRUE,"The weeks of March 23rd and 30th cafeteria staff coming in to make breakfast and lunch. The week of March 16th the school district will provide a food truck at the school and is working with local firefighters to deliver meals.
",,,https://desmoines.k12.nm.us/,,,,Des Moines,NM,88418,36.761140,-103.834130,Union County,US,1,place,,,,575-734-5420
23,Dexter Consolidated Schools,TRUE,Dexter Consolidated Schools will be serving Grab n Go sack breakfast and lunch every day from 11-1. Meals will also be provided for the Lake Arthur area.  Location: 100 N Lincoln – in front of the High School Cafeteria. Spring break schedule (March 23-27) TBD.,,11 a.m. to 1 p.m.,http://www.dexterdemons.org/,,,,Dexter,NM,88230,33.238749,-104.397276,Chaves County,US,1,place,,,,575-734-5420
24,Dora Consolidated Schools,TRUE,"Dora Consolidate Schools will be providing ""grab and go"" meals for students Monday - Thursday during the three weeks school is out.  Please contact the office with names of students so the cafeteria can be prepared. 505-477-2211",,Not available,doraschools.com,,,,Dora,NM,88115,33.938700,-103.336620,Roosevelt County,US,1,place,,,,575-477-2211
25,Dulce Independent Schools,TRUE,"Monday, March 16, 2020: Parents are asked to sign-up in the Dulce Middle School Lobby for Breakfast/Lunch Program for their PK - 12th grade students.",,Signups begin at 9 a.m.,https://nm02211120.schoolwires.net/cms/lib/NM02211120/Centricity/Domain/4/James%20Cammon%20PSA%20DISD%20March%2013%202020.pdf,,,,Dulce,NM,87528,36.934793,-106.995107,Rio Arriba County,US,1,place,,,,
26,Elida Municipal Schools,TRUE,"Elida Schools will offer breakfast and lunch to all students Monday-Thursday for the duration of the shut-down.  The meals will be located in the district’s front office from 10:00 a.m. – 1:00 p.m. each day.  Please call the main office at 575-274-6211 and leave a message by 8:00 a.m. Monday morning (March16th) if you plan to come get meals for your students so that we are prepared, but not over prepared and waste food.",,10 a.m. to 1 p.m.,http://elidaschools.net/,,,,Elida,NM,88116,33.985296,-103.494855,Roosevelt County,US,1,place,,,,575-274-6211
27,Espanola Public Schools,TRUE,"Grab & Go breakfast and lunch at all schools sites during March 16th -- March 19th.  Beginning on March 20th,  Espanola Public Schools will deliver meals throughout the community.",,,http://www.k12espanola.org/,,,,Espanola,NM,87532,35.993867,-106.088977,Rio Arriba County,US,1,place,,,,"505-753-2254
sites/times will be posted on website"
28,Estancia Municipal Schools,TRUE,"Beginning on March 19th, Grab & Go lunch with breakfast included will be available at the school. The district is working on delivery to Willard, Torreoon, Tajique, and Macintosh locations.  Estancia will post a flier with serving times and locations as well as call students as soon as the additional locations are in service (no later than March 24th).",,To be announced.,https://www.estancia.k12.nm.us/,,,,Estancia,NM,87016,34.752146,-106.160660,Torrance County,US,1,place,,,,after march 18
29,Eunice Public Schools,TRUE,"Grab & Go will be available March 16th - 20th and March 30th - April 3rd.  Students must be present and sign-in to pick up breakfast and/or lunch.  Service will be at the back of Mettie Jordan Elemenary, using the bus loop.",,"Breakfast: 8 a.m. to 8:30 a.m. 
Lunch: 11:30 a.m. to 12:30 p.m.",https://www.eunice.org/cms/lib/NM02211123/Centricity/ModuleInstance/91/2020_03_13_SchoolClosure.pdf,,,,Eunice,NM,88231,32.440629,-103.183360,Lea County,US,1,place,,,,
30,Farmington Municipal Schools,TRUE,"Farmington Municipal Schools will provide meals for Pre-K-12th grade students from March 23rd - April 3rd (excluding Spring Break March 16th - 20th). This includes breakfast and lunch, Monday through Friday only. Breakfast and lunch will be distributed at the same time, from 8-10 a.m., at the following sites: Animas, Apache, Bluffview, McCormick, Esperanza and McKinley Elementaries, Hermosa and Tibbetts Middle Schools, and Farmington and Rocinante High Schools. For parents who cannot pick up during this time, three evening pick up locations will be available from 5-7 p.m. at Central Kitchen (305 N. Court Ave. in Farmington), Tibbetts Middle School and Mesa View Middle School. Parents can pick up meals for the following day during the evening pick up. ALL FMS STUDENTS MUST BE PRESENT WITH THEIR PARENTS TO PICK UP MEALS. Meals must be taken home and not eaten on school premises. Unfortunately, FMS cannot provide any special diet accommodations.",,"Breakfast & Lunch: 8 to 10 a.m.
Evening: 5 to 7 p.m.",https://district.fms.k12.nm.us/district/departments/exceptional_programs/health_services/coronavirus_prevention_and_response,,,,Farmington,NM,87401,36.740321,-108.178691,San Juan County,US,1,place,,,,beginning march 23
31,Floyd Municipal Schools,TRUE,"Beginning Monday March 16th, free breakfast and lunch will be offered to all students of Floyd Schools and pre-school age siblings. Both meals will be served at the same time (between 8:00 am - 11:30 am), but only one day's meals will be served at a time.  Please call the office with additional questions: 575-478-2211.",,8 a.m. to 11:30 a.m.,http://www.floydbroncos.com/,,,,Floyd,NM,88118,34.181943,-103.589732,Roosevelt County,US,1,place,,,,
32,Fort Sumner Municipal Schools,TRUE,"Beginning Monday March 16th, students K-12 are encouraged to come to the school cafeteria to pick up a grab & go breakfast and lunch.  Both meals will be provided at the same time and will be available on normally scheduled school days.",,8:30 a.m. to 10:30 a.m.,https://www.facebook.com/FSMSchools,,,,Fort Sumner,NM,88119,34.531467,-104.174298,De Baca County,US,1,place,,,,
33,Gadsden Independent Schools,TRUE,Grab & Go breakfast and lunch meals will be avaliable for all students during the three week closure. Please visit the website to see the 17 pickup locations,,"Breakfast: 8:30 a.m. to 9:30 a.m.
Lunch: 11:30 a.m. to 12:30 p.m.",http://www.gisd.k12.nm.us/,,,,Sunland Park,NM,,31.841936,-106.619944,Dona Ana,US,0,,,,,"3/12 - ""Gadsden ISD is working on a plan to provide grab-and-go meals to ensure there is no interruption in nutritional services to students and families that depend on them."""
34,Gallup Mckinley County Schools,TRUE,"Families can pick up breakfast and lunch between Monday, March 23rd - Friday, March 27th and Monday, March 30th - Friday, April 3rd, 2020. Free meals will be provided to chidlren ages 1 - 18 and students must be present to claim their meal.  Students may pick the most convenient site - does not need to be their home school.  Adult meals will not be available.",,"Breakfast: 8:30 a.m. to 9:30 a.m.
Lunch: 11 a.m. to 1 p.m.",https://4.files.edl.io/85ab/03/15/20/010312-e0f81588-0346-48b3-9a09-649f2f705e3c.pdf,,,,Gallup,NM,87301,35.534983,-108.737949,McKinley County,US,1,place,,,,multiple distribution sites - visit link for details
35,Grady Municipal Schools,TRUE,Grady school district is working directly with families to deliver food boxes to homes.,,,http://www.gradyschool.com/,,,,Grady,NM,88120,34.817795,-103.354685,Curry County,US,1,place,,,,575-357-2192
36,Grants Cibola County Schools,TRUE,"Meal availability begins Tuesday, March 17th.  For students who ordinarily ride the bus to school, meals will be delivered to the bus stops where the student would normally be picked up.  For students who do not ordinarily ride the bus, grab & go meals will be available for pick-up at their regular school sites. Pick up times will be announced on the district website.",,To be announced.,https://www.gccs.k12.nm.us/,,,,Grants,NM,87020,35.147260,-107.851450,Cibola County,US,1,place,,,,505-285-2600
37,Hagerman Municipal Schools,TRUE,"Schools will be distributing grab & go breakfast and lunch meals starting  Monday, March 16th – Friday, March 20th. Students must have ID cards with no exceptions!",,10 a.m. to 11 a.m.,http://www.bobcat.net/coronavirus-in-new-mexico/,,,,Hagerman,NM,88232,33.101546,-104.356588,Chaves County,US,1,place,,,,
38,Hatch Valley Public Schools,TRUE,"Students may come on Monday, March 16, 2020 from 10:30am - 1:30pm, to pick up five shelf-stable breakfast and lunch meals at one time.  Families may use either distribution site: Longfellow Elementary @ Lobby, 715 S. Highland Ave. OR Brooks Middle School @ Commons, 325 S. Kenliworth Ave.","March 16, 2020",10:30 a.m. to 1:30 p.m.,https://www.facebook.com/HatchSchool/photos/rpp.150948304996498/2735398746551428/?type=3&theater,,,,Hatch,NM,87937,32.661331,-107.123524,Doña Ana County,US,1,place,,,,
39,Hobbs Muncipal Schools,TRUE,Grab & Go breakfast and lunch meals will be served Monday - Firday at all 13 Elementary Schools. Secondary students encouraged to go the Elementary closest to their home.,,"Breakfast: 7:30 to 8:15a.m.
Lunch: 11:30a.m. to 12:15p.m.",http://www.hobbsschools.net/news/current_news/updates_on_school_closure/,,,,Hobbs,NM,88240,32.703708,-103.485112,Lea County,US,1,place,,,,575-433-0100
40,Hondo Valley Public Schools,TRUE,Hondo Valley Public Schools will be providing grab & go breakfast and lunch meals in front of the cafeteria from March 16th - March 19th.,,10 a.m. to 11 a.m.,https://www.hondoschools.org/news#fooddistributionnotice,,,,Hondo,NM,88336,33.387590,-105.270820,Lincoln County,US,1,place,,,,
41,House Municipal Schools,TRUE,No information currently available.,,,http://www.houseschools.net/,,,,House,NM,88121,34.646730,-103.904410,Quay County,US,1,place,,,,575-279-7353
42,Jal Public Schools,TRUE,"Grab & go breakfast and lunch meals will be served March 16th - 19th and March 23th - April 2nd; meals will not be served during Spring Break.  Pre-K - 12 students may pick up meals at the elementary school, Monday - Thursday.",,"Beakfast: 7:30 a.m. to 8:15 a.m.
Lunch: 11:30 a.m. to 12:30 p.m.",https://www.facebook.com/jal.schools?fref=search&__tn__=%2Cd%2CP-R&eid=ARDlCjHQTF-End_gScCQZW8UrpyD8ocMAhVacQppDXCTlCO7h3tupoMLdfFAxfVa5Jn7HExGGHo870Sn,,,,Jal,NM,88252,32.094646,-103.193924,Lea County,US,1,place,,,,575-395-2101
43,Jemez Mountain Public Schools,,No information currently available.,,,http://www.jmsd.k12.nm.us/,,,,Jemez Pueblo,NM,87024,35.655141,-106.739455,Sandoval County,US,1,place,,,,
44,Jemez Valley Public Schools,TRUE,"Breakfasts and Lunches – Jemez Valley Schools will be delivering breakfasts and lunches to our student’s bus stops beginning Monday, March 16th through Wednesday March 25th between 8:00 a.m. and 8:30 a.m.  These Grab and Go meals will be given to students / parents at the bus stop so watch for those meal deliveries.  It would be helpful if you would inform us if you’d like to opt out. To opt out, please leave that message on the cafeteria phone by calling 505-842-0902 ext 327 or 575-834-7391 ext 327.
Food Pantry- The Food Pantry will be open for food dissemination this Wednesday from 10 am until supplies last, but we will limit the numbers of people inside the Pantry so please be patient as we try to serve everyone in need as quickly as possible.",,8 a.m. to 8:30 a.m.,http://www.jvps.org/,,,,Jemez Pueblo,NM,87024,35.655141,-106.739455,Sandoval County,US,1,place,,,,
45,Lake Arthur Municipal Schools,TRUE,"Dexter Schools will provide a free meal for Lake Arthur students during spring break.
March 16- 20, 2020 from 11:00 AM to 1:00 PM.
Grab and Go sack lunches may be picked up in front of the High School Cafeteria at 100 N. Lincoln

Any student enrolled in Lake Arthur Municipal Schools can pick up a free breakfast from 9:00 am -  9:30 am and/or a free lunch from 11:30 am -  12:00 pm during the two weeks AFTER Spring Break- from Monday, March 23, 2020 to Friday, April 3, 2020.","Dexter Schools: March 16 to 20
Lake Arthur Municipal Schools: March 23 to April 3","Dexter Schools: 11 a.m. to 1 p.m.

Lake Arthur Municipal Schools:
Breakfast 9 a.m. to 9:30 a.m.
Lunch: 11:30 a.m. to 12 p.m.",https://www.facebook.com/LAPANTHERS/,,,,Lake Arthur,NM,88253,32.998170,-104.366630,Chaves County,US,1,place,,,,
47,Las Vegas City Public Schools,TRUE,"Beginning Monday, March 16, 2020 through April 3, 2020, Las Vegas City Schools will be serving grab & go breakfasts and lunch to students. At this time, no one will be allowed to eat in the cafeteria. Buses will travel to outlying communities following their bus routes to deliver breakfast and lunch. 

Bus numbers delivering are 71, 80, 82, and 64. 

School based health clinics will remain open.
",,"Serving times are as follows:

Silas Lopez ECC:Breakfast 8:30 a.m. – 9:30 a.m.; Lunch 11:30 a.m. – 12:30 p.m.

Sierra Vista Elementary Breakfast 8:30 a.m. – 9:30 a.m.; Lunch 11:30 a.m. – 12:30 p.m.

Bus delivery for Breakfast: Leave Las Vegas at 8 a.m.

Bus delivery for Lunch: Leave Las Vegas at 11 a.m.",https://www.cybercardinal.com/apps/news/article/1182754,,,,Las Vegas,NM,87701,35.551539,-104.985643,San Miguel County,US,1,place,,,,
48,Logan Municipal Schools,TRUE,Logan Municipal Schools will provide meals for students. Contact the school for location and times. Students who are bussed in from Clovis will be directed to use Clovis meal locations.,,,http://www.loganschool.net/home,,,,Logan,NM,88426,35.524530,-103.264281,Quay County,US,1,place,,,,
49,Lordsburg Municipal Schools,TRUE,"Beginning March 16th, grab & go breakfast and lunch meals for students can be picked up at the main cafeteria located at the Administration building. Both breakfast and lunch may be picked up at the same time. Schedule: Monday - Thursday 7:30 am - 11:00 am.",,7:30 a.m. to 11 a.m.,https://www.facebook.com/LordsburgMunicipalSchools/,,,,Lordsburg,NM,88045,32.315951,-108.723047,Hidalgo County,US,1,place,,,,
50,Los Lunas Public Schools,TRUE,"Beginning March 17, 2020, Los Lunas Public Schools will provide FREE breakfast and lunch to all students. Both Meals will be served from 11:30 am - 1:00 om every weekday, except holidays. Meals will be provided to students at several school sites and in the community. All meals will be ""grab and go"" and will be served by driving through a line. Adult meals will cost $4.00.

The following sites will provide meals to students during the 3-week closure:

• Ann Parish Elementary
• Meadowlake Fire Station
• Desert View Elementary
• Los Lunas Elementary
• Katherine Gallegos Elementary
• Huning Ranch Park
• Los Lunas High School
• Peralta Elementary

​For students who live in the Highland Meadows area, LLPS will be providing both breakfast and lunch outside of the Highland Meadows Community Center between 11:30am and 1:00pm. Children must be present to receive the meals. Adult meals will cost $4.00",,11:30 a.m. to 1 p.m.,http://www.llschools.net/news/free_meals_for_students_during_closure,,,,Los Lunas,NM,87031,34.765770,-106.712287,Valencia County,US,1,place,,,,
51,Loving Municipal Schools,TRUE,"Grab & Go meals will be available to all students during the school closure period. Meals can be picked up at the Loving High School Cafeteria. 

March 16th - 19th
March 30th  – April 2nd

Meals will not be served during the scheduled Spring Break week: March 23rd – March 26th
Times and dates are subject to change. Check the LMS Facebook page for updates.",,"Breakfast: 8 a.m. to 9 a.m.
Lunch: 11 a.m. to 12 p.m.",https://www.facebook.com/LovingMunicipalSchools/,,,,Loving,NM,88256,32.272039,-104.147248,Eddy County,US,1,place,,,,
52,Lovington Municipal Schools,TRUE,"All Lovington students grades Pre-K-12 will be able to get grab & go breakfast and lunch meals at Gann Cafeteria, Monday - Friday, for the duration of the school closure period.",,"Breakfast: 8 a.m. to 8:45 a.m.
Lunch: 11:30 a.m. to 12:30 p.m.",https://www.facebook.com/LovingtonMunicipalSchools/,,,,Lovington,NM,88260,32.944010,-103.348550,Lea County,US,1,place,,,,
53,Magdalena Municipal Schools,,No information currently available.,,,https://www.facebook.com/Magdalena-Municipal-School-District-465826963437203/,,,,Magdalena,NM,87825,34.111424,-107.240895,Socorro County,US,1,place,,,,
54,Maxwell Municipal Schools,TRUE,Serving Grab and Go Breakfast and Lunch at the Maxwell Housing Authority (215 6th St) for all three weeks,,"Breakfast: 8 a.m. to 9 a.m.
Lunch: 12 p.m. to 1 p.m.",http://www.maxwellp12.com/,,,,Maxwell,NM,87728,36.539682,-104.559057,Colfax County,US,1,place,,,,
55,Melrose Public Schools,,No information currently available.,,,http://www.melroseschools.org/,,,,Melrose,NM,88124,34.505120,-103.564506,Curry County,US,1,place,,,,
